{
  "$schema": "https://json-schema.org/draft/2020-12/schema",
  "$id": "https://pocketdeck.dev/schemas/config/v2/config.schema.json",
  "title": "PocketDeck Configuration v2",
  "description": "Transport-independent published configuration. Configuration revision and epoch are carried by the protocol snapshot, not embedded in this document.",
  "$comment": "JSON Schema validates local structure. Consumers must also enforce globally unique IDs, action references, grid capacity, total serialized size, and target/type compatibility.",
  "type": "object",
  "additionalProperties": false,
  "required": ["schema_version", "deck", "profiles", "actions"],
  "properties": {
    "schema_version": {
      "const": 2
    },
    "deck": {
      "type": "object",
      "additionalProperties": false,
      "required": ["id", "name"],
      "properties": {
        "id": {
          "$ref": "#/$defs/id",
          "description": "Stable identity for this deck across transports and publication revisions."
        },
        "name": {
          "type": "string",
          "minLength": 1,
          "maxLength": 64
        }
      }
    },
    "profiles": {
      "type": "array",
      "minItems": 0,
      "maxItems": 32,
      "items": {
        "$ref": "#/$defs/profile"
      }
    },
    "commands": {
      "type": "array",
      "maxItems": 64,
      "items": {
        "$ref": "#/$defs/command"
      },
      "description": "Optional saved Windows command definitions."
    },
    "shortcuts": {
      "type": "array",
      "maxItems": 64,
      "items": {
        "$ref": "#/$defs/savedShortcut"
      }
    },
    "settings": {
      "type": "object",
      "additionalProperties": false,
      "properties": {
        "confirm_commands": {
          "type": "boolean",
          "default": false
        }
      }
    },
    "actions": {
      "type": "array",
      "minItems": 0,
      "maxItems": 128,
      "items": {
        "$ref": "#/$defs/action"
      }
    }
  },
  "$defs": {
    "id": {
      "type": "string",
      "minLength": 1,
      "maxLength": 64,
      "pattern": "^[A-Za-z0-9][A-Za-z0-9_-]*$",
      "description": "Stable identifier, unique across profiles, pages, buttons, and actions."
    },
    "profile": {
      "type": "object",
      "additionalProperties": false,
      "required": ["id", "name", "pages"],
      "properties": {
        "id": {
          "$ref": "#/$defs/id"
        },
        "name": {
          "type": "string",
          "minLength": 1,
          "maxLength": 64
        },
        "pages": {
          "type": "array",
          "minItems": 0,
          "maxItems": 32,
          "items": {
            "$ref": "#/$defs/page"
          }
        }
      }
    },
    "page": {
      "type": "object",
      "additionalProperties": false,
      "required": ["id", "name", "grid", "buttons"],
      "properties": {
        "id": {
          "$ref": "#/$defs/id"
        },
        "name": {
          "type": "string",
          "minLength": 1,
          "maxLength": 64
        },
        "grid": {
          "type": "object",
          "additionalProperties": false,
          "required": ["columns", "rows"],
          "properties": {
            "columns": {
              "type": "integer",
              "minimum": 1,
              "maximum": 8
            },
            "rows": {
              "type": "integer",
              "minimum": 1,
              "maximum": 8
            }
          }
        },
        "buttons": {
          "type": "array",
          "maxItems": 64,
          "description": "Array order is display order, laid out row by row. Consumers reject a page whose button count exceeds rows multiplied by columns.",
          "items": {
            "$ref": "#/$defs/button"
          }
        }
      }
    },
    "button": {
      "type": "object",
      "additionalProperties": false,
      "required": ["id", "label", "action_id"],
      "properties": {
        "id": {
          "$ref": "#/$defs/id"
        },
        "label": {
          "type": "string",
          "minLength": 1,
          "maxLength": 64
        },
        "icon": {
          "type": ["string", "null"],
          "minLength": 1,
          "maxLength": 128,
          "description": "Optional non-executable presentation reference. Unknown references must use a safe fallback."
        },
        "color": {
          "type": ["string", "null"],
          "pattern": "^#[0-9A-Fa-f]{6}$",
          "description": "Optional six-digit RGB presentation color."
        },
        "action_id": {
          "description": "A stable ID referring to a declared action, or null when no action is assigned.",
          "anyOf": [
            {
              "$ref": "#/$defs/id"
            },
            {
              "type": "null"
            }
          ]
        }
      }
    },
    "action": {
      "type": "object",
      "additionalProperties": false,
      "required": ["id", "target", "type", "enabled_for_execution", "parameters"],
      "properties": {
        "id": {
          "$ref": "#/$defs/id"
        },
        "target": {
          "enum": ["android_local", "windows_host"],
          "description": "Execution location, independent of the transport used to publish or invoke this action."
        },
        "type": {
          "enum": ["open_url", "application", "system_control", "system_monitor", "keyboard_shortcut", "run_command"]
        },
        "enabled_for_execution": {
          "type": "boolean",
          "description": "Configuration/UI intent only; it is not an authorization grant or a substitute for host-side policy."
        },
        "parameters": {
          "type": "object"
        }
      },
      "allOf": [
        {
          "if": {
            "properties": {
              "type": {
                "const": "system_monitor"
              }
            },
            "required": ["type"]
          },
          "then": {
            "properties": {
              "parameters": {
                "$ref": "#/$defs/systemMonitorParameters"
              },
              "target": {
                "const": "windows_host"
              },
              "enabled_for_execution": {
                "const": false,
                "description": "System monitoring is read-only and cannot be executed."
              }
            }
          }
        },
        {
          "if": {
            "properties": {
              "type": {
                "const": "open_url"
              }
            },
            "required": ["type"]
          },
          "then": {
            "properties": {
              "parameters": {
                "$ref": "#/$defs/openUrlParameters"
              }
            }
          }
        },
        {
          "if": {
            "properties": {
              "type": {
                "const": "application"
              }
            },
            "required": ["type"]
          },
          "then": {
            "properties": {
              "parameters": {
                "$ref": "#/$defs/applicationParameters"
              },
              "target": {
                "const": "windows_host"
              }
            }
          }
        },
        {
          "if": {
            "properties": {
              "type": {
                "const": "system_control"
              }
            },
            "required": ["type"]
          },
          "then": {
            "properties": {
              "parameters": {
                "$ref": "#/$defs/systemControlParameters"
              },
              "target": {
                "const": "windows_host"
              }
            }
          }
        },
        {
          "if": {
            "properties": {
              "type": {
                "const": "keyboard_shortcut"
              }
            },
            "required": ["type"]
          },
          "then": {
            "properties": {
              "parameters": {
                "$ref": "#/$defs/keyboardShortcutParameters"
              },
              "target": {
                "const": "windows_host"
              }
            }
          }
        },
        {
          "if": {
            "properties": {
              "type": {
                "const": "run_command"
              }
            },
            "required": ["type"]
          },
          "then": {
            "properties": {
              "parameters": {
                "$ref": "#/$defs/runCommandParameters"
              },
              "target": {
                "const": "windows_host"
              }
            }
          }
        }
      ]
    },
    "openUrlParameters": {
      "type": "object",
      "additionalProperties": false,
      "required": ["url"],
      "properties": {
        "url": {
          "type": "string",
          "format": "uri",
          "maxLength": 2048,
          "pattern": "^https?://"
        },
        "name": {
          "type": "string",
          "minLength": 1,
          "maxLength": 64,
          "description": "Optional friendly name shown in the editor and reusable action list."
        }
      }
    },
    "applicationParameters": {
      "type": "object",
      "additionalProperties": false,
      "required": ["name", "path"],
      "properties": {
        "name": {
          "type": "string",
          "minLength": 1,
          "maxLength": 64,
          "description": "Friendly name displayed in PocketDeck."
        },
        "path": {
          "type": "string",
          "minLength": 3,
          "maxLength": 32768,
          "pattern": "^(?:[A-Za-z]:[\\\\/]|\\\\\\\\[^\\\\/]+[\\\\/][^\\\\/]+[\\\\/]).*\\.[eE][xX][eE]$",
          "description": "Absolute Windows executable path chosen explicitly by the user; the backend checks existence and launches this path directly without a shell."
        }
      }
    },
    "systemControlParameters": {
      "type": "object",
      "additionalProperties": false,
      "required": ["control"],
      "properties": {
        "control": {
          "enum": [
            "volume_up",
            "volume_down",
            "mute_toggle",
            "brightness_up",
            "brightness_down"
          ]
        }
      }
    },
    "systemMonitorParameters": {
      "type": "object",
      "additionalProperties": false,
      "required": ["metric"],
      "properties": {
        "metric": {
          "enum": [
            "cpu_utilization",
            "memory_usage",
            "gpu_utilization",
            "gpu_temperature",
            "cpu_temperature"
          ],
          "description": "Read-only telemetry metric displayed on its assigned button."
        }
      }
    },
    "keyboardShortcutParameters": {
      "type": "object",
      "additionalProperties": false,
      "properties": {
        "shortcut": {
          "$ref": "#/$defs/keyboardShortcutValue"
        },
        "shortcut_id": {
          "$ref": "#/$defs/id"
        }
      },
      "oneOf": [
        {
          "required": ["shortcut"],
          "not": {
            "required": ["shortcut_id"]
          }
        },
        {
          "required": ["shortcut_id"],
          "not": {
            "required": ["shortcut"]
          }
        }
      ]
    },
    "runCommandParameters": {
      "type": "object",
      "additionalProperties": false,
      "required": ["command_id"],
      "properties": {
        "command_id": {
          "$ref": "#/$defs/id"
        }
      }
    },
    "savedShortcut": {
      "type": "object",
      "additionalProperties": false,
      "required": ["id", "name", "shortcut"],
      "properties": {
        "id": {
          "$ref": "#/$defs/id"
        },
        "name": {
          "type": "string",
          "minLength": 1,
          "maxLength": 64
        },
        "shortcut": {
          "$ref": "#/$defs/keyboardShortcutValue"
        }
      }
    },
    "keyboardShortcutValue": {
      "type": "string",
      "maxLength": 64,
      "pattern": "^(copy|paste|cut|undo|redo|save|select_all|switch_app|((CTRL|ALT|SHIFT|WIN)\\+)*(CTRL|ALT|SHIFT|WIN)\\+([A-Z0-9]|NUMPAD[0-9]|F([1-9]|1[0-9]|2[0-4])|ENTER|NUMPADENTER|TAB|ESC|SPACE|BACKSPACE|DELETE|INSERT|HOME|END|PAGEUP|PAGEDOWN|UP|DOWN|LEFT|RIGHT|BACKQUOTE|MINUS|EQUAL|BRACKETLEFT|BRACKETRIGHT|BACKSLASH|SEMICOLON|QUOTE|COMMA|PERIOD|SLASH|NUMPADADD|NUMPADSUBTRACT|NUMPADMULTIPLY|NUMPADDIVIDE|NUMPADDECIMAL))$",
      "allOf": [
        {
          "not": {
            "pattern": "(^|\\+)CTRL(\\+[^+]+)*\\+CTRL($|\\+)"
          }
        },
        {
          "not": {
            "pattern": "(^|\\+)ALT(\\+[^+]+)*\\+ALT($|\\+)"
          }
        },
        {
          "not": {
            "pattern": "(^|\\+)SHIFT(\\+[^+]+)*\\+SHIFT($|\\+)"
          }
        },
        {
          "not": {
            "pattern": "(^|\\+)WIN(\\+[^+]+)*\\+WIN($|\\+)"
          }
        },
        {
          "not": {
            "pattern": "(^|\\+)WIN(\\+[^+]+)*\\+L$"
          }
        },
        {
          "not": {
            "pattern": "(^|\\+)WIN(\\+[^+]+)*\\+R$"
          }
        }
      ],
      "description": "Canonical chords use modifiers in Ctrl, Alt, Shift, Windows order. Windows-reserved Windows+L and Windows+R are not supported."
    },
    "command": {
      "type": "object",
      "additionalProperties": false,
      "required": ["id", "name", "steps"],
      "properties": {
        "id": {
          "$ref": "#/$defs/id"
        },
        "definition_version": {
          "const": 1,
          "default": 1,
          "description": "Version of the saved command behavior contract."
        },
        "name": {
          "type": "string",
          "minLength": 1,
          "maxLength": 64
        },
        "description": {
          "type": "string",
          "maxLength": 256,
          "default": ""
        },
        "category": {
          "type": "string",
          "minLength": 1,
          "maxLength": 32,
          "default": "General"
        },
        "enabled": {
          "type": "boolean",
          "default": true
        },
        "steps": {
          "type": "array",
          "minItems": 1,
          "maxItems": 20,
          "items": {
            "$ref": "#/$defs/commandStep"
          }
        }
      }
    },
    "commandStep": {
      "type": "object",
      "additionalProperties": false,
      "required": ["type", "parameters"],
      "properties": {
        "type": {
          "enum": ["open_url", "keyboard_shortcut", "wait"]
        },
        "parameters": {
          "oneOf": [
            {
              "$ref": "#/$defs/openUrlParameters"
            },
            {
              "$ref": "#/$defs/keyboardShortcutParameters"
            },
            {
              "$ref": "#/$defs/waitParameters"
            }
          ]
        }
      },
      "allOf": [
        {
          "if": {
            "properties": {"type": {"const": "open_url"}},
            "required": ["type"]
          },
          "then": {
            "properties": {
              "parameters": {"$ref": "#/$defs/openUrlParameters"}
            }
          }
        },
        {
          "if": {
            "properties": {"type": {"const": "keyboard_shortcut"}},
            "required": ["type"]
          },
          "then": {
            "properties": {
              "parameters": {"$ref": "#/$defs/keyboardShortcutParameters"}
            }
          }
        },
        {
          "if": {
            "properties": {"type": {"const": "wait"}},
            "required": ["type"]
          },
          "then": {
            "properties": {
              "parameters": {"$ref": "#/$defs/waitParameters"}
            }
          }
        }
      ]
    },
    "waitParameters": {
      "type": "object",
      "additionalProperties": false,
      "required": ["milliseconds"],
      "properties": {
        "milliseconds": {
          "type": "integer",
          "minimum": 0,
          "maximum": 10000
        }
      }
    }
  }
}
